"","title","authors","abstract","categories","submitted","id","doi"
"34","Kochen-Specker theorem for 8-dimensional space","Michael Kernaghan|Asher Peres","  A Kochen-Specker contradiction is produced with 36 vectors in a real
8-dimensional Hilbert space. These vectors can be combined into 30 distinct
projection operators (14 of rank 2, and 16 of rank 1). A state-specific variant
of this contradiction requires only 13 vectors, a remarkably low number for 8
dimensions.
","quant-ph","1994-12-26 07:21:13","quant-ph/9412006v1","10.1016/0375-9601(95)00012-R"
"35","Infinite matrices may violate the associative law","Ofir E. Alon|Nimrod Moiseyev|Asher Peres","  The momentum operator for a particle in a box is represented by an infinite
order Hermitian matrix $P$. Its square $P^2$ is well defined (and diagonal),
but its cube $P^3$ is ill defined, because $P P^2\neq P^2 P$. Truncating these
matrices to a finite order restores the associative law, but leads to other
curious results.
","quant-ph","1994-12-26 11:30:51","quant-ph/9412007v2","10.1088/0305-4470/28/6/027"
"36","On the Stronger Statement of Levinson's Theorem for the Dirac Equation","Zhong-Qi Ma","  Recently a stronger statement of Levinson's theorem for the Dirac equation
was presented, where the limits of the phase shifts at $E=\pm M$ are related to
the numbers of nodes of radial functions at the same energies, respectively.
However, in this letter we show that this statement has to be modified because
the limits of the phase shifts may be negative for the Dirac equation.
","quant-ph","1994-12-26 14:46:37","quant-ph/9412005v1",""
"37","A general formulation of discrete-time quantum mechanics, restrictions
  on the action and the relation of unitarity to the existence theorem for
  initial-value problems","M. Khorrami","  A general formlulation for discrete-time quantum mechanics, based on
Feynman's method in ordinary quantum mechanics, is presented. It is shown that
the ambiguities present in ordinary quantum mechanics (due to noncommutativity
of the operators), are no longer present here. Then the criteria for the
unitarity of the evolution operator is examined. It is shown that the unitarity
of the evolution operator puts restrictions on the form of the action, and also
implies the existence of a solution for the classical initial-value problem.
","quant-ph","1994-12-28 08:16:58","quant-ph/9412008v1","10.1006/aphy.1995.1108"
"38","Superconvergent Perturbation Method in Quantum Mechanics","Wolfgang Scherer","  An analogue of Kolmogorov's superconvergent perturbation theory in classical
mechanics is constructed for self adjoint operators. It is different from the
usual Rayleigh--Schr\""odinger perturbation theory and yields expansions for
eigenvalues and eigenvectors in terms of functions of the perturbation
parameter.
","quant-ph","1994-12-30 12:31:04","quant-ph/9412009v1","10.1103/PhysRevLett.74.1495"
"39","Quantum Averaging I: Poincaré--von Zeipel is Rayleigh--Schrödinger","Wolfgang Scherer","  An exact analogue of the method of averaging in classical mechanics is
constructed for self--adjoint operators. It is shown to be completely
equivalent to the usual Rayleigh--Schr\""odinger perturbation theory but gives
the sums over intermediate states in closed form expressions. The anharmonic
oscillator and the Henon--Heiles system are treated as examples to illustrate
the quantum averaging method.
","quant-ph","1994-12-30 12:54:24","quant-ph/9412010v1","10.1088/0305-4470/27/24/028"
"40","Two Mode Quantum Systems: Invariant Classification of Squeezing
  Transformations and Squeezed States"," Arvind|B. Dutta|N. Mukunda|R. Simon","  A general analysis of squeezing transformations for two mode systems is given
based on the four dimensional real symplectic group $Sp(4,\Re)\/$. Within the
framework of the unitary metaplectic representation of this group, a
distinction between compact photon number conserving and noncompact photon
number nonconserving squeezing transformations is made. We exploit the
$Sp(4,\Re)-SO(3,2)\/$ local isomorphism and the $U(2)\/$ invariant squeezing
criterion to divide the set of all squeezing transformations into a two
parameter family of distinct equivalence classes with representative elements
chosen for each class. Familiar two mode squeezing transformations in the
literature are recognized in our framework and seen to form a set of measure
zero. Examples of squeezed coherent and thermal states are worked out. The need
to extend the heterodyne detection scheme to encompass all of $U(2)\/$ is
emphasized, and known experimental situations where all $U(2)\/$ elements can
be reproduced are briefly described.
","quant-ph","1994-12-31 10:18:28","quant-ph/9412011v1","10.1103/PhysRevA.52.1609"
